{
  "schema_version": "0.1.1",
  "nodes": [
    {
      "id": "FACT-DST-001",
      "entry_type": "source_fact",
      "status": "supported_by_klei"
    },
    {
      "id": "FACT-DST-002",
      "entry_type": "source_fact",
      "status": "supported_by_klei"
    },
    {
      "id": "FACT-DST-003",
      "entry_type": "source_fact",
      "status": "supported_by_klei"
    },
    {
      "id": "FACT-DST-004",
      "entry_type": "source_fact",
      "status": "supported_by_klei"
    },
    {
      "id": "FACT-DST-005",
      "entry_type": "source_fact",
      "status": "supported_by_klei"
    },
    {
      "id": "FACT-DST-006",
      "entry_type": "source_fact",
      "status": "supported_by_klei"
    },
    {
      "id": "FACT-DST-007",
      "entry_type": "source_fact",
      "status": "supported_by_klei"
    },
    {
      "id": "FACT-DST-008",
      "entry_type": "source_fact",
      "status": "supported_by_klei"
    },
    {
      "id": "FACT-DST-009",
      "entry_type": "source_fact",
      "status": "supported_by_klei"
    },
    {
      "id": "FACT-DST-010",
      "entry_type": "source_fact",
      "status": "supported_by_klei"
    },
    {
      "id": "PATTERN-NET-001",
      "entry_type": "pattern",
      "status": "candidate"
    },
    {
      "id": "PATTERN-SHARD-001",
      "entry_type": "pattern",
      "status": "candidate"
    },
    {
      "id": "PATTERN-WORLD-001",
      "entry_type": "pattern",
      "status": "candidate"
    },
    {
      "id": "PATTERN-FRAMEWORK-001",
      "entry_type": "pattern",
      "status": "candidate"
    },
    {
      "id": "RULE-NET-001",
      "entry_type": "rule",
      "status": "candidate"
    },
    {
      "id": "RULE-STATE-001",
      "entry_type": "rule",
      "status": "candidate"
    },
    {
      "id": "RULE-STATE-002",
      "entry_type": "rule",
      "status": "candidate"
    },
    {
      "id": "RULE-STATE-003",
      "entry_type": "rule",
      "status": "candidate"
    },
    {
      "id": "RULE-NET-002",
      "entry_type": "rule",
      "status": "candidate"
    },
    {
      "id": "RULE-STATE-004",
      "entry_type": "rule",
      "status": "candidate"
    },
    {
      "id": "RULE-SHARD-001",
      "entry_type": "rule",
      "status": "candidate"
    },
    {
      "id": "RULE-WORLD-001",
      "entry_type": "rule",
      "status": "candidate"
    },
    {
      "id": "RULE-PERSIST-001",
      "entry_type": "rule",
      "status": "candidate"
    },
    {
      "id": "RULE-RESOURCE-001",
      "entry_type": "rule",
      "status": "candidate"
    },
    {
      "id": "RULE-RESOURCE-002",
      "entry_type": "rule",
      "status": "candidate"
    },
    {
      "id": "RULE-NET-003",
      "entry_type": "rule",
      "status": "candidate"
    },
    {
      "id": "RULE-LIFE-001",
      "entry_type": "rule",
      "status": "candidate"
    },
    {
      "id": "RULE-HOOK-001",
      "entry_type": "rule",
      "status": "candidate"
    },
    {
      "id": "RULE-HOOK-002",
      "entry_type": "rule",
      "status": "candidate"
    },
    {
      "id": "RULE-HOOK-003",
      "entry_type": "rule",
      "status": "candidate"
    },
    {
      "id": "RULE-WORLD-002",
      "entry_type": "rule",
      "status": "candidate"
    },
    {
      "id": "RULE-FRAMEWORK-001",
      "entry_type": "rule",
      "status": "candidate"
    },
    {
      "id": "ANTI-NET-001",
      "entry_type": "anti_pattern",
      "status": "candidate"
    },
    {
      "id": "ANTI-SHARD-001",
      "entry_type": "anti_pattern",
      "status": "candidate"
    },
    {
      "id": "ANTI-SHARD-002",
      "entry_type": "anti_pattern",
      "status": "candidate"
    },
    {
      "id": "ANTI-RESOURCE-001",
      "entry_type": "anti_pattern",
      "status": "candidate"
    },
    {
      "id": "ANTI-HOOK-001",
      "entry_type": "anti_pattern",
      "status": "candidate"
    },
    {
      "id": "ANTI-HOOK-002",
      "entry_type": "anti_pattern",
      "status": "candidate"
    },
    {
      "id": "ANTI-LIFE-001",
      "entry_type": "anti_pattern",
      "status": "candidate"
    },
    {
      "id": "ANTI-WORLD-001",
      "entry_type": "anti_pattern",
      "status": "candidate"
    },
    {
      "id": "ANTI-FRAMEWORK-001",
      "entry_type": "anti_pattern",
      "status": "candidate"
    },
    {
      "id": "FAIL-CASE001-001",
      "entry_type": "failure_case",
      "status": "needs_runtime_validation"
    },
    {
      "id": "FAIL-CASE001-002",
      "entry_type": "failure_case",
      "status": "needs_runtime_validation"
    },
    {
      "id": "FAIL-CASE001-003",
      "entry_type": "failure_case",
      "status": "needs_runtime_validation"
    },
    {
      "id": "FAIL-CASE001-004",
      "entry_type": "failure_case",
      "status": "needs_runtime_validation"
    },
    {
      "id": "CORRECTION-CASE001-001",
      "entry_type": "correction",
      "status": "corrected"
    },
    {
      "id": "DECISION-STATE-OWNER-001",
      "entry_type": "decision",
      "status": "candidate"
    },
    {
      "id": "DECISION-NET-001",
      "entry_type": "decision",
      "status": "candidate"
    },
    {
      "id": "DECISION-SHARD-001",
      "entry_type": "decision",
      "status": "candidate"
    },
    {
      "id": "DECISION-PERSIST-001",
      "entry_type": "decision",
      "status": "candidate"
    },
    {
      "id": "DECISION-HOOK-001",
      "entry_type": "decision",
      "status": "candidate"
    },
    {
      "id": "TEST-NET-001",
      "entry_type": "test_case",
      "status": "candidate"
    },
    {
      "id": "TEST-NET-002",
      "entry_type": "test_case",
      "status": "candidate"
    },
    {
      "id": "TEST-SHARD-001",
      "entry_type": "test_case",
      "status": "candidate"
    },
    {
      "id": "TEST-LIFE-001",
      "entry_type": "test_case",
      "status": "candidate"
    },
    {
      "id": "TEST-LIFE-002",
      "entry_type": "test_case",
      "status": "candidate"
    },
    {
      "id": "TEST-LIFE-003",
      "entry_type": "test_case",
      "status": "candidate"
    },
    {
      "id": "TEST-HOOK-001",
      "entry_type": "test_case",
      "status": "candidate"
    },
    {
      "id": "TEST-HOOK-002",
      "entry_type": "test_case",
      "status": "candidate"
    },
    {
      "id": "TEST-RESOURCE-001",
      "entry_type": "test_case",
      "status": "candidate"
    },
    {
      "id": "TEST-SHARD-002",
      "entry_type": "test_case",
      "status": "candidate"
    },
    {
      "id": "TEST-NET-003",
      "entry_type": "test_case",
      "status": "candidate"
    },
    {
      "id": "ARP-DST-001",
      "entry_type": "playbook",
      "status": "candidate"
    },
    {
      "id": "CASE-001",
      "entry_type": "case",
      "status": "validated_single_case"
    }
  ],
  "source_nodes": [
    {
      "id": "REPORT-R4",
      "type": "prior_analysis_report"
    },
    {
      "id": "REPORT-R5",
      "type": "prior_analysis_report"
    },
    {
      "id": "REPORT-R6",
      "type": "prior_analysis_report"
    },
    {
      "id": "META-MODINFO",
      "type": "case_metadata"
    },
    {
      "id": "KLEI-LOCAL-20260928",
      "type": "vanilla_source_snapshot"
    },
    {
      "id": "CASE-001-PORTABLE-METADATA",
      "type": "derived_case_metadata"
    }
  ],
  "claim_nodes": [
    {
      "id": "CLAIM-CASE001-001",
      "type": "historical_claim",
      "status": "superseded"
    }
  ],
  "edges": [
    {
      "from": "FACT-DST-001",
      "relation": "related",
      "to": "ARP-DST-001"
    },
    {
      "from": "KLEI-LOCAL-20260928",
      "relation": "supports",
      "to": "FACT-DST-001"
    },
    {
      "from": "FACT-DST-001",
      "relation": "related",
      "to": "REPORT-R6"
    },
    {
      "from": "FACT-DST-002",
      "relation": "related",
      "to": "ARP-DST-001"
    },
    {
      "from": "KLEI-LOCAL-20260928",
      "relation": "supports",
      "to": "FACT-DST-002"
    },
    {
      "from": "FACT-DST-002",
      "relation": "related",
      "to": "REPORT-R6"
    },
    {
      "from": "FACT-DST-003",
      "relation": "related",
      "to": "ARP-DST-001"
    },
    {
      "from": "KLEI-LOCAL-20260928",
      "relation": "supports",
      "to": "FACT-DST-003"
    },
    {
      "from": "FACT-DST-003",
      "relation": "related",
      "to": "REPORT-R6"
    },
    {
      "from": "FACT-DST-004",
      "relation": "related",
      "to": "ARP-DST-001"
    },
    {
      "from": "KLEI-LOCAL-20260928",
      "relation": "supports",
      "to": "FACT-DST-004"
    },
    {
      "from": "FACT-DST-004",
      "relation": "related",
      "to": "REPORT-R6"
    },
    {
      "from": "FACT-DST-005",
      "relation": "related",
      "to": "ARP-DST-001"
    },
    {
      "from": "KLEI-LOCAL-20260928",
      "relation": "supports",
      "to": "FACT-DST-005"
    },
    {
      "from": "FACT-DST-005",
      "relation": "related",
      "to": "REPORT-R6"
    },
    {
      "from": "FACT-DST-006",
      "relation": "related",
      "to": "ARP-DST-001"
    },
    {
      "from": "KLEI-LOCAL-20260928",
      "relation": "supports",
      "to": "FACT-DST-006"
    },
    {
      "from": "FACT-DST-006",
      "relation": "related",
      "to": "REPORT-R6"
    },
    {
      "from": "FACT-DST-007",
      "relation": "related",
      "to": "ARP-DST-001"
    },
    {
      "from": "KLEI-LOCAL-20260928",
      "relation": "supports",
      "to": "FACT-DST-007"
    },
    {
      "from": "FACT-DST-007",
      "relation": "related",
      "to": "REPORT-R5"
    },
    {
      "from": "FACT-DST-008",
      "relation": "related",
      "to": "ARP-DST-001"
    },
    {
      "from": "KLEI-LOCAL-20260928",
      "relation": "supports",
      "to": "FACT-DST-008"
    },
    {
      "from": "FACT-DST-008",
      "relation": "related",
      "to": "REPORT-R4"
    },
    {
      "from": "FACT-DST-009",
      "relation": "related",
      "to": "ARP-DST-001"
    },
    {